{
  "schema_version": "1.0.0",
  "report_type": "MAX_BIPED_SKELETON_CONTRACT_v1_REPORT",
  "job_id": "job-release-character-controlled-real-skeleton-001",
  "package_id": "char.maxine.release_pilot.max_biped_v1",
  "lane": "release_character",
  "candidate_id": "max_biped_v1_candidate_001",
  "source_asset_reference": "examples/sandbox/evidence-sources/approved-local-inputs/characters/max_biped_v1/source_character.fbx",
  "source_evidence_ref": "examples/sandbox/evidence-bundles/max_biped_v1_candidate_001_controlled_real_skeleton.bundle.json",
  "skeleton_profile_id": "MAX_BIPED_v1",
  "skeleton_profile_version": "1.0.0",
  "skeleton_evidence_class": "controlled_real",
  "root_bone_status": "pass",
  "pelvis_bone_status": "pass",
  "spine_chain_status": "pass",
  "neck_head_status": "pass",
  "left_arm_chain_status": "pass",
  "right_arm_chain_status": "pass",
  "left_leg_chain_status": "pass",
  "right_leg_chain_status": "pass",
  "hand_finger_status": "pass",
  "naming_convention_status": "pass",
  "hierarchy_status": "pass",
  "orientation_status": "pass",
  "scale_status": "pass",
  "bind_pose_status": "pass",
  "bone_count": 29,
  "required_bones_present": [
    "root",
    "pelvis",
    "spine_01",
    "spine_02",
    "neck",
    "head",
    "clavicle_l",
    "upperarm_l",
    "lowerarm_l",
    "hand_l",
    "clavicle_r",
    "upperarm_r",
    "lowerarm_r",
    "hand_r",
    "thigh_l",
    "calf_l",
    "foot_l",
    "thigh_r",
    "calf_r",
    "foot_r"
  ],
  "missing_required_bones": [],
  "extra_bones": [
    "upperarm_twist_01_l",
    "upperarm_twist_01_r",
    "lowerarm_twist_01_l",
    "lowerarm_twist_01_r",
    "thigh_twist_01_l",
    "thigh_twist_01_r",
    "calf_twist_01_l",
    "calf_twist_01_r",
    "jaw"
  ],
  "retarget_readiness_status": "pass",
  "animation_smoke_dependency_status": "pass",
  "claim_status": "evidence_only",
  "safety": {
    "dcc_execution_status": "blocked",
    "blender_execution_status": "blocked",
    "o3de_execution_status": "blocked",
    "production_write_status": "blocked"
  },
  "status": "pass",
  "findings": [],
  "manifest_attachment": {
    "target_path": "qc.gates[]",
    "future_target_path": "qc.checks[]",
    "qc_check": {
      "check_id": "max_biped_v1_skeleton_contract",
      "result": "pass",
      "severity": "info",
      "details": {
        "summary": "Controlled-real MAX_BIPED skeleton evidence validates core chain, hierarchy, and readiness statuses.",
        "evidence_class": "controlled_real"
      }
    }
  }
}
