{
  "schema_version": "1.0.0",
  "report_type": "MAX_BIPED_SKELETON_CONTRACT_v1_REPORT",
  "job_id": "job-release-character-controlled-real-skeleton-002",
  "package_id": "char.maxine.release_pilot.max_biped_v1",
  "lane": "release_character",
  "candidate_id": "max_biped_v1_candidate_001",
  "source_asset_reference": "examples/sandbox/evidence-sources/approved-local-inputs/characters/max_biped_v1/source_character.fbx",
  "source_evidence_ref": "examples/sandbox/evidence-bundles/max_biped_v1_candidate_001_controlled_real_skeleton.bundle.json",
  "skeleton_profile_id": "MAX_BIPED_v1",
  "skeleton_profile_version": "1.0.0",
  "skeleton_evidence_class": "controlled_real",
  "root_bone_status": "pass",
  "pelvis_bone_status": "pass",
  "spine_chain_status": "pass",
  "neck_head_status": "pass",
  "left_arm_chain_status": "pass",
  "right_arm_chain_status": "pass",
  "left_leg_chain_status": "pass",
  "right_leg_chain_status": "pass",
  "hand_finger_status": "warn",
  "naming_convention_status": "pass",
  "hierarchy_status": "pass",
  "orientation_status": "pass",
  "scale_status": "pass",
  "bind_pose_status": "pass",
  "bone_count": 27,
  "required_bones_present": [
    "root",
    "pelvis",
    "spine_01",
    "spine_02",
    "neck",
    "head",
    "clavicle_l",
    "upperarm_l",
    "lowerarm_l",
    "hand_l",
    "clavicle_r",
    "upperarm_r",
    "lowerarm_r",
    "hand_r",
    "thigh_l",
    "calf_l",
    "foot_l",
    "thigh_r",
    "calf_r",
    "foot_r"
  ],
  "missing_required_bones": [],
  "extra_bones": [
    "upperarm_twist_01_l",
    "upperarm_twist_01_r",
    "lowerarm_twist_01_l",
    "thigh_twist_01_l",
    "thigh_twist_01_r",
    "calf_twist_01_l",
    "calf_twist_01_r"
  ],
  "retarget_readiness_status": "warn",
  "animation_smoke_dependency_status": "pass",
  "claim_status": "not_authoritative",
  "safety": {
    "dcc_execution_status": "blocked",
    "blender_execution_status": "blocked",
    "o3de_execution_status": "blocked",
    "production_write_status": "blocked"
  },
  "status": "warn",
  "findings": [
    {
      "id": "finger_mirror_helper_gap",
      "severity": "warning",
      "status": "open",
      "message": "Optional finger helper mirror coverage is incomplete and should be reviewed."
    }
  ],
  "manifest_attachment": {
    "target_path": "qc.gates[]",
    "future_target_path": "qc.checks[]",
    "qc_check": {
      "check_id": "max_biped_v1_skeleton_contract",
      "result": "warn",
      "severity": "warning",
      "details": {
        "summary": "Controlled-real skeleton evidence has warning-level helper/retarget findings.",
        "evidence_class": "controlled_real"
      }
    }
  }
}
